{
  "decision": {
    "decision": "refused",
    "by": "Inaya Yousfi",
    "date": "2026-10-28",
    "reason": "not-allowed: The redistribution of Monkey's Audio is only allowed in cases where the original installer and"
  },
  "kind": "license",
  "files": [],
  "explanation": "This is a custom license that limits redistribution and requires code changes to be contributed back. No accepted license matches it."
}
