{
  "decision": {
    "decision": "admitted",
    "by": "Inaya Yousfi",
    "date": "2026-10-28"
  },
  "kind": "license",
  "license": "MIT",
  "found": {
    "source": "github-tsayen-dom-to-image-61d8f383",
    "path": "node_modules/string_decoder/LICENSE"
  },
  "files": [
    "21a82bbee91262a076c2e34533d51d73475d55e889f1c42cf884c86b2a0d5773"
  ],
  "explanation": "standard text of MIT, SPDX release v3.29.0"
}
