{
  "decision": {
    "decision": "admitted",
    "by": "Inaya Yousfi",
    "date": "2026-10-29"
  },
  "kind": "notice",
  "found": {
    "source": "github-apify-crawlee-58c0429f",
    "path": "test/e2e/cheerio-page-info/actor/package.json"
  },
  "files": [
    "f67834977007bd0b4ec85c0d4a82c1bb9d03166217ff0aba65c32b0433d2a325"
  ],
  "explanation": "A package.json whose license field declares \"ISC\": it names the license without its text, so the entry's text holds that license's official text.",
  "license": "ISC"
}
