{
  "decision": {
    "decision": "refused",
    "by": "Inaya Yousfi",
    "date": "2026-10-28",
    "reason": "not-allowed: This Font Software is licensed under the SIL Open Font License, Version 1.1."
  },
  "kind": "license",
  "license": "OFL-1.1",
  "files": [],
  "explanation": "The SIL Open Font License is not on the accepted list."
}
