{
  "decision": {
    "decision": "admitted",
    "by": "Inaya Yousfi",
    "date": "2026-10-28"
  },
  "kind": "license",
  "license": "Apache-2.0",
  "found": {
    "source": "github-containrrr-watchtower-d05a1620",
    "path": "LICENSE.md"
  },
  "files": [
    "2456e9a853b01c35c9c0ec613c99a84d98c9991ca8c9d31b2e295a276be71bca"
  ],
  "explanation": "standard text of Apache-2.0, SPDX release v3.29.0"
}
