{
  "decision": {
    "decision": "under-review",
    "by": "Inaya Yousfi",
    "date": "2026-10-28",
    "reason": "the review's verdict: gpl-version-unclear"
  },
  "kind": "license",
  "license": "GPL-2.0-or-later",
  "files": [],
  "explanation": "The GPL option names no version and does not say \"only\" or \"or later\". The file also offers a commercial license as the alternative."
}
