{
  "decision": {
    "decision": "refused",
    "by": "Inaya Yousfi",
    "date": "2026-10-28",
    "reason": "not-allowed: modify or distribute the source code of the software so that any part of it becomes subject to an Excluded License."
  },
  "kind": "license",
  "files": [],
  "explanation": "The file bundles MIT texts and a Microsoft 'Custom License' for WindowsAPICodePack. That license bars making any part of its code subject to a copyleft-type Excluded License, so it is refused."
}
