{
  "decision": {
    "decision": "admitted",
    "by": "Inaya Yousfi",
    "date": "2026-10-28"
  },
  "kind": "license",
  "license": "BSD-2-Clause",
  "found": {
    "source": "github-yarnpkg-yarn-60c94267",
    "path": "LICENSE"
  },
  "files": [
    "ae09761b5d27e237571245437653b483bbb85de3cc64b802e8ef47d03aabec1e"
  ],
  "explanation": "standard text of BSD-2-Clause, SPDX release v3.29.0"
}
