{
  "decision": {
    "decision": "refused",
    "by": "Inaya Yousfi",
    "date": "2026-10-28",
    "reason": "not-allowed: \"license\": \"BSD\","
  },
  "kind": "license",
  "files": [],
  "explanation": "The package file names only BSD without a clause count, so no accepted license is identified and the doubt is refused."
}
