{
  "decision": {
    "decision": "admitted",
    "by": "Inaya Yousfi",
    "date": "2026-10-28"
  },
  "kind": "license",
  "license": "BSD-3-Clause",
  "found": {
    "source": "github-pytorch-pytorch-6ee2c2a3",
    "path": "torch/fx/experimental/unification/LICENSE.txt"
  },
  "files": [
    "d0eb08f977f3dee279187e77074ae959b8a1e261482eeb49b04ba39b95a928dd"
  ],
  "explanation": "standard text of BSD-3-Clause, SPDX release v3.29.0"
}
