{
  "decision": {
    "decision": "admitted",
    "by": "Inaya Yousfi",
    "date": "2026-10-28"
  },
  "kind": "notice",
  "license": "GPL-3.0-or-later",
  "files": [],
  "explanation": "A Debian copyright notice names GPL version 3 with the words or (at your option) any later version. Those words make it -or-later."
}
