{
  "decision": {
    "decision": "admitted",
    "by": "Inaya Yousfi",
    "date": "2026-10-28"
  },
  "kind": "license",
  "license": "BSD-3-Clause",
  "found": {
    "source": "github-nixos-nixpkgs-fd81e3fd",
    "path": "nixos/tests/postgresql/wal2json/LICENSE"
  },
  "files": [
    "ce1ab5c34c7d1efb09443c9f210cbfcd848d754ed863fef0ac50a614a7be99f4"
  ],
  "explanation": "standard text of BSD-3-Clause, SPDX release v3.29.0"
}
