{
  "decision": {
    "decision": "admitted",
    "by": "Inaya Yousfi",
    "date": "2026-10-28"
  },
  "kind": "license",
  "license": "MIT",
  "files": [],
  "explanation": "MIT text with an added condition: the user must pay royalties owed for third-party codec technologies. The condition is in the notice that comes before the MIT text."
}
