{
  "decision": {
    "decision": "refused",
    "by": "Inaya Yousfi",
    "date": "2026-10-28",
    "reason": "not-allowed: Fonts are free under - SIL OFL 1.1 License:"
  },
  "kind": "license",
  "license": "OFL-1.1",
  "files": [],
  "explanation": "The file offers the fonts under SIL OFL 1.1, which the section does not accept. The icon part under CC-BY-4.0 does not remove this refusal."
}
