{
  "decision": {
    "decision": "admitted",
    "by": "Inaya Yousfi",
    "date": "2026-10-28"
  },
  "kind": "readme",
  "files": [],
  "explanation": "The visible README parts contain no statement refusing or restricting AI or machine-learning training. The middle 14 KB of the README was not visible."
}
