{
  "decision": {
    "decision": "admitted",
    "by": "Inaya Yousfi",
    "date": "2026-10-28"
  },
  "kind": "readme",
  "files": [],
  "explanation": "The README asks contributors not to submit AI-generated pull requests. It says nothing about AI or machine-learning training, so it is not a training refusal."
}
