{
  "decision": {
    "decision": "under-review",
    "by": "machine:wpt-dataset",
    "date": "2026-10-29",
    "reason": "first met in a source: a person reads it"
  },
  "kind": "notice",
  "found": {
    "source": "github-pedronauck-docz-130a3231",
    "path": "other-packages/e2e-tests/package.json"
  },
  "files": [
    "6742ac5e94592d876ac7b9f2619c9c1002c1f1fec5a01fc9bc3e3ef0fe600b20"
  ],
  "explanation": "A package.json whose license field declares \"ISC\": it names the license without its text, so the entry's text holds that license's official text.",
  "license": "ISC"
}
