{
  "decision": {
    "decision": "admitted",
    "by": "Inaya Yousfi",
    "date": "2026-10-28"
  },
  "kind": "license",
  "license": "GPL-2.0-or-later",
  "files": [],
  "explanation": "This is the full GPL-2.0 text. Its sample notice says 'any later version', which gives -or-later under the section's rule."
}
