{
  "decision": {
    "decision": "admitted",
    "by": "Inaya Yousfi",
    "date": "2026-10-29"
  },
  "kind": "notice",
  "found": {
    "source": "github-gatsbyjs-gatsby-bcb790ee",
    "path": "scripts/add-npm-owner/package.json"
  },
  "files": [
    "a8c05149be2926e5510bc5dee991937960df3a41afd3cc55a8f64c28c25ad129"
  ],
  "explanation": "A package.json whose license field declares \"ISC\": it names the license without its text, so the entry's text holds that license's official text.",
  "license": "ISC"
}
