{
  "decision": {
    "decision": "refused",
    "by": "Inaya Yousfi",
    "date": "2026-10-28",
    "reason": "the review's verdict: not-a-license"
  },
  "kind": "not-a-license",
  "files": [],
  "explanation": "This is Go test code that checks license text generation. The MIT comment is a file header, not a license grant."
}
