{
  "decision": {
    "decision": "under-review",
    "by": "Inaya Yousfi",
    "date": "2026-10-28",
    "reason": "the review's verdict: no-license-found"
  },
  "kind": "not-a-license",
  "files": [],
  "explanation": "The file gives MIT permission only for the Horizon Zero Dawn assets; the cemyuksel hair models state no license, and the file does not license them."
}
