{
  "decision": {
    "decision": "refused",
    "by": "Inaya Yousfi",
    "date": "2026-10-28",
    "reason": "not-allowed: 3. All modifications to the source code must be clearly marked as"
  },
  "kind": "license",
  "license": "BSD-2-Clause",
  "files": [],
  "explanation": "This MySpell license is close to BSD-2-Clause but adds a condition that modified code must be marked, and that license is not on the accepted list."
}
