{
  "decision": {
    "decision": "admitted",
    "by": "Inaya Yousfi",
    "date": "2026-10-28"
  },
  "kind": "readme",
  "files": [],
  "explanation": "The visible parts contain no statement refusing or restricting AI or machine-learning training; 3243 bytes in the middle were not in the excerpt."
}
