{
  "decision": {
    "decision": "admitted",
    "by": "Inaya Yousfi",
    "date": "2026-10-28"
  },
  "kind": "license",
  "license": "GPL-3.0-only OR GPL-3.0-or-later",
  "found": {
    "source": "github-electronicarts-cnc-remastered-collection-52eb7cc2",
    "path": "CnCTDRAMapEditor/License.txt"
  },
  "files": [
    "a59ee506a8d315b76bf344e67b3d521e818f862e7711fdd850a36c888ba1e953"
  ],
  "explanation": "standard text of GPL-3.0-only OR GPL-3.0-or-later, SPDX release v3.29.0"
}
